{
  "schemaVersion": "1.0.0",
  "profile": {
    "domain": "judicial-ai-assurance",
    "version": "2026.1",
    "status": "L1-poc",
    "ruleCount": 12,
    "hardStopCount": 9,
    "sourceHash": "sha256:593a577ed630631aef176a8ae3539bcdd6dcd50ed0a8e4f42eb3547ed8c0b869"
  },
  "disclaimer": "Dit profiel inventariseert assurance-eisen. Het berekent geen juridische goedkeuring en vervangt geen beoordeling door een bevoegde jurist of rechterlijke governancefunctie.",
  "scenarios": [
    {
      "scenarioId": "assistive-summary",
      "title": "Brongebonden assistieve samenvatting",
      "summary": "AI maakt uitsluitend een voorstel met passage-level bronverwijzingen. Alle bewijs is synthetisch aanwezig; de bevoegde menselijke beslissing ontbreekt bewust.",
      "expectedBoundary": "review-required",
      "status": "review-required",
      "blockedControls": [],
      "humanDecision": null,
      "controls": [
        {
          "controlId": "JAI-001",
          "name": "Onderbouw subsidiariteit voordat generatieve AI wordt ingezet",
          "controlClass": "hard-stop",
          "status": "review-required",
          "missingEvidence": [],
          "failedEvidence": [],
          "evidenceRefs": [
            "E-001"
          ]
        },
        {
          "controlId": "JAI-002",
          "name": "Classificeer beslisimpact, juridische openheid en AI Act-risico",
          "controlClass": "hard-stop",
          "status": "review-required",
          "missingEvidence": [],
          "failedEvidence": [],
          "evidenceRefs": [
            "E-001"
          ]
        },
        {
          "controlId": "JAI-003",
          "name": "Rechterlijke bevoegdheid en toegang tot een menselijke rechter blijven gewaarborgd",
          "controlClass": "hard-stop",
          "status": "review-required",
          "missingEvidence": [],
          "failedEvidence": [],
          "evidenceRefs": [
            "E-002"
          ]
        },
        {
          "controlId": "JAI-004",
          "name": "AI-uitvoer is niet bindend en mag geen afwijkingsmotivering afdwingen",
          "controlClass": "hard-stop",
          "status": "review-required",
          "missingEvidence": [],
          "failedEvidence": [],
          "evidenceRefs": [
            "E-002"
          ]
        },
        {
          "controlId": "JAI-005",
          "name": "AI-gebruik is transparant, betwistbaar en verenigbaar met equality of arms",
          "controlClass": "hard-stop",
          "status": "review-required",
          "missingEvidence": [],
          "failedEvidence": [],
          "evidenceRefs": [
            "E-002"
          ]
        },
        {
          "controlId": "JAI-006",
          "name": "Iedere inhoudelijke AI-claim is herleidbaar tot een authentieke bron",
          "controlClass": "hard-stop",
          "status": "review-required",
          "missingEvidence": [],
          "failedEvidence": [],
          "evidenceRefs": [
            "E-005"
          ]
        },
        {
          "controlId": "JAI-007",
          "name": "Voer vooraf en iteratief een grondrechten-, risico- en impactbeoordeling uit",
          "controlClass": "required-evidence",
          "status": "review-required",
          "missingEvidence": [],
          "failedEvidence": [],
          "evidenceRefs": [
            "E-006"
          ]
        },
        {
          "controlId": "JAI-008",
          "name": "Gerechtelijke data en infrastructuur blijven effectief onder publieke regie",
          "controlClass": "hard-stop",
          "status": "review-required",
          "missingEvidence": [],
          "failedEvidence": [],
          "evidenceRefs": [
            "E-006"
          ]
        },
        {
          "controlId": "JAI-009",
          "name": "Opschaling vereist onafhankelijke evaluatie, monitoring en terugdraaibaarheid",
          "controlClass": "hard-stop",
          "status": "review-required",
          "missingEvidence": [],
          "failedEvidence": [],
          "evidenceRefs": [
            "E-003"
          ]
        },
        {
          "controlId": "JAI-010",
          "name": "Behandel processtukken en externe inhoud als onvertrouwde AI-invoer",
          "controlClass": "required-evidence",
          "status": "review-required",
          "missingEvidence": [],
          "failedEvidence": [],
          "evidenceRefs": [
            "E-003",
            "E-004",
            "E-006"
          ]
        },
        {
          "controlId": "JAI-011",
          "name": "AI krijgt geen autonome formele handelings- of schrijfbevoegdheid",
          "controlClass": "hard-stop",
          "status": "review-required",
          "missingEvidence": [],
          "failedEvidence": [],
          "evidenceRefs": [
            "E-004"
          ]
        },
        {
          "controlId": "JAI-012",
          "name": "Behoud kritisch vakmanschap, opleiding en een werkbaar niet-AI-pad",
          "controlClass": "required-evidence",
          "status": "review-required",
          "missingEvidence": [],
          "failedEvidence": [],
          "evidenceRefs": [
            "E-006"
          ]
        }
      ],
      "evidence": [
        {
          "sourceSystem": "juraregel",
          "status": "observed",
          "artifactRef": "demo://intended-purpose-and-subsidiarity",
          "summary": "Synthetische intended-purpose-, subsidiariteits- en risicoanalyse is aanwezig voor inhoudelijke review.",
          "artifactTypes": [
            "problem-definition",
            "conventional-alternatives",
            "necessity-and-proportionality",
            "intended-purpose",
            "decision-impact",
            "legal-openness",
            "action-authority",
            "ai-act-classification"
          ],
          "id": "E-001",
          "recordHash": "sha256:2508aee792aad991859c1647d9254951df48dd4edface6db0bd6329e6168e996"
        },
        {
          "sourceSystem": "juraregel",
          "status": "observed",
          "artifactRef": "demo://judicial-governance-procedure",
          "summary": "Synthetische procedure beschrijft menselijke toegang, voorbehouden functies, opt-out, tegenspraak en herstel.",
          "artifactTypes": [
            "human-judge-access",
            "reserved-human-functions",
            "fallback-procedure",
            "opt-out",
            "no-departure-justification",
            "automation-bias-controls",
            "independent-analysis-procedure",
            "party-disclosure",
            "equality-of-arms-assessment",
            "contest-procedure",
            "effective-remedy"
          ],
          "id": "E-002",
          "recordHash": "sha256:cee86f2d85a9aeaf4fa529aa1970e8f9a5c45eda42322e07cb1d6e7980acb8ad"
        },
        {
          "sourceSystem": "openmythos",
          "status": "observed",
          "runId": "synthetic-openmythos-assistive-summary-v1",
          "artifactRef": "demo://openmythos/assistive-summary-evaluation",
          "summary": "Preregistered synthetische evaluatie met taak-goldset, subgroepanalyse, stopcriteria en rollbacktest; inhoudelijke beoordeling blijft open.",
          "artifactTypes": [
            "independent-evaluation",
            "task-specific-gold-set",
            "subgroup-and-bias-analysis",
            "drift-monitoring",
            "incident-plan",
            "stop-criteria",
            "rollback-test",
            "indirect-prompt-injection-tests",
            "retrieval-poisoning-tests"
          ],
          "id": "E-003",
          "recordHash": "sha256:6e386345bbe0ace964050c85a821093fdc2f4c61bc0bf53af43899408a59df8c"
        },
        {
          "sourceSystem": "djimitflo",
          "status": "observed",
          "runId": "synthetic-djimitflo-assistive-summary-v1",
          "artifactRef": "demo://djimitflo/assistive-summary-trace",
          "summary": "Synthetische capability- en action-trace toont proposal-only output, deny-by-default en gescheiden menselijke autorisatie.",
          "artifactTypes": [
            "proposal-only-ai-output",
            "separate-human-validation",
            "separate-human-authorisation",
            "capability-deny-by-default",
            "immutable-action-log",
            "least-privilege-tools",
            "default-deny-egress"
          ],
          "id": "E-004",
          "recordHash": "sha256:9a38891272edfa447d95c45a2e70dde5bed7eefc4ff52f84608a08900b1e1930"
        },
        {
          "sourceSystem": "traceability",
          "status": "observed",
          "artifactRef": "demo://lineage/assistive-summary",
          "summary": "Synthetische claim-to-source lineage bevat document, passage, bron-, retrieval-, model- en promptversies.",
          "artifactTypes": [
            "document-id",
            "passage-id",
            "source-version",
            "source-hash",
            "retrieval-record",
            "model-and-prompt-version"
          ],
          "id": "E-005",
          "recordHash": "sha256:752063ce02a0cb32e855812ad0f1f6da40df848d21c4414633bf851353b4194a"
        },
        {
          "sourceSystem": "governance",
          "status": "observed",
          "artifactRef": "demo://impact-and-sovereignty",
          "summary": "Synthetische impact-, publieke-regie-, contract-, security- en competentiedocumentatie is aanwezig.",
          "artifactTypes": [
            "ai-act-fria-or-applicability",
            "huderia-cobra",
            "stakeholder-engagement",
            "mitigation-plan",
            "iterative-review",
            "data-residency",
            "key-control",
            "no-training-clause",
            "subprocessor-control",
            "audit-right",
            "exit-and-portability",
            "retention-and-deletion",
            "content-isolation",
            "security-incident-response",
            "role-based-training",
            "competence-assessment",